{
  "contract_version": "1.0.0",
  "job_id": "01jrk8m4q4xv2v8d4d4ymf5xnk",
  "tenant_id": "01jrk8m4q4xv2v8d4d4ymf5tnt",
  "document_id": "01jrk8m4q4xv2v8d4d4ymf5doc",
  "document_revision": 3,
  "page_id": "01jrk8m4q4xv2v8d4d4ymf5p01",
  "page_number": 1,
  "status": "succeeded",
  "engine": {
    "name": "paddleocr",
    "version": "2.7.3",
    "model_set": "PP-OCRv4-server-zh",
    "preprocessing_applied": ["deskew:1.8deg", "upscale:200dpi->300dpi"]
  },
  "page_metrics": {
    "detected_dpi": 198,
    "detected_orientation_deg": 0,
    "detected_dominant_script": "zh-Hans",
    "page_width_px": 2480,
    "page_height_px": 3508,
    "processing_duration_ms": 4321,
    "queued_duration_ms": 870
  },
  "raw_text": "上海市浦东新区人民法院\n民事判决书\n(2025) 沪0115民初12345号\n证据目录\n上海市浦东新区人民法院",
  "blocks": [
    {
      "block_id": "b_0001",
      "type": "heading",
      "text": "上海市浦东新区人民法院",
      "confidence": 0.982,
      "bbox": { "x": 412, "y": 188, "w": 1656, "h": 96 },
      "polygon": [[412,188],[2068,188],[2068,284],[412,284]],
      "reading_order": 1,
      "writing_mode": "horizontal-tb",
      "language": "zh-Hans",
      "words": [
        { "text": "上海市浦东新区人民法院", "confidence": 0.982, "bbox": { "x": 412, "y": 188, "w": 1656, "h": 96 } }
      ]
    },
    {
      "block_id": "b_0002",
      "type": "paragraph",
      "text": "右起竖排说明文字示例",
      "confidence": 0.91,
      "bbox": { "x": 2200, "y": 400, "w": 80, "h": 1200 },
      "polygon": [[2200,400],[2280,400],[2280,1600],[2200,1600]],
      "reading_order": 2,
      "writing_mode": "vertical-rl",
      "language": "zh-Hans"
    },
    {
      "block_id": "b_0017",
      "type": "seal",
      "text": "上海市浦东新区人民法院",
      "confidence": 0.71,
      "bbox": { "x": 1680, "y": 2900, "w": 480, "h": 480 },
      "polygon": [[1680,2900],[2160,2900],[2160,3380],[1680,3380]],
      "reading_order": 99,
      "writing_mode": "horizontal-tb",
      "language": "zh-Hans",
      "seal_shape": "circle",
      "overlaps_block_ids": ["b_0014", "b_0015"]
    },
    {
      "block_id": "b_0023",
      "type": "table",
      "confidence": 0.84,
      "bbox": { "x": 200, "y": 2200, "w": 2080, "h": 600 },
      "reading_order": 50,
      "table": {
        "rows": 2,
        "cols": 4,
        "cells": [
          { "row": 0, "col": 0, "text": "证据序号", "confidence": 0.96, "row_span": 1, "col_span": 1 },
          { "row": 0, "col": 1, "text": "证据名称", "confidence": 0.95, "row_span": 1, "col_span": 1 },
          { "row": 0, "col": 2, "text": "证明对象", "confidence": 0.94, "row_span": 1, "col_span": 1 },
          { "row": 0, "col": 3, "text": "页码",     "confidence": 0.97, "row_span": 1, "col_span": 1 },
          { "row": 1, "col": 0, "text": "证1",       "confidence": 0.93, "row_span": 1, "col_span": 1 },
          { "row": 1, "col": 1, "text": "购销合同", "confidence": 0.92, "row_span": 1, "col_span": 1 },
          { "row": 1, "col": 2, "text": "合同关系成立", "confidence": 0.90, "row_span": 1, "col_span": 1 },
          { "row": 1, "col": 3, "text": "1-3",       "confidence": 0.95, "row_span": 1, "col_span": 1 }
        ]
      }
    }
  ],
  "review": {
    "manual_review_recommended": true,
    "reasons": ["seal_overlap", "low_dpi"],
    "low_confidence_block_ids": ["b_0017"],
    "page_confidence_summary": {
      "min": 0.71,
      "median": 0.92,
      "mean": 0.89,
      "p10": 0.74,
      "fraction_below_0_80": 0.08
    }
  },
  "partial_failure": null,
  "metadata": {
    "trace_id": "00-4bf92f3577b34da6a3ce929d0e0e4736-00f067aa0ba902b7-01",
    "originating_request_id": "req_01jrk8m4",
    "client_tags": ["evidence-index", "court-filing-2025-hu-min-12345"]
  },
  "completed_at": "2026-04-27T08:14:37.643+08:00"
}
